{"adapter":{"id":"agent-memory-runtime-baseline-v7-stdio","revision":"git-blob:0f2f18b0d1ec62edc2a1d424af6cbaa967774ec2","version":"0.1.0"},"authority_effect":"none","benchmark_isolation":{"description":"benchmark-owned disposable Agent Memory SQLite state keyed by the Gauntlet run namespace","strategy":"disposable_instance"},"capabilities":{"describe":{"notes":"translated public runtime identity only","support":"mapped"},"health":{"notes":"public AgentMemory.posture() health projection","support":"mapped"},"recall":{"notes":"public AgentMemory.recall() through fixed benchmark tenant/scope","support":"native"},"remember":{"notes":"public AgentMemory.remember() through fixed benchmark tenant/scope","support":"native"},"reset":{"notes":"adapter teardown of disposable benchmark state; not a native Agent Memory operation","support":"mapped"}},"contract_family":"agent-memory-gauntlet-system-adapter","contract_version":"0.1.0","metadata":{"baseline_id":"agent-memory-runtime-baseline-v7","provenance_class":"unqualified_transition_probe","public_facade_only":true,"runtime_profile":"rc1-local-sqlite-composition"},"system":{"configuration_digest":"sha256:e4548a487b8c83ef9172bb9076933b493a7d91b9de2239fd5409f7992b88ff82","id":"agent-memory-runtime-baseline-v7","kind":"agent_memory","revision":"git-commit:2ad4cf23d366fc784a486b0245550230e64bfa25","version":"0.2.0-rc1"},"transport":{"kind":"stdio","startup":["python","examples/gauntlet/agent_memory_runtime_baseline_v7_stdio.py"]}}
