{
  "adapter": {
    "id": "gauntlet-lexical-in-process",
    "revision": "builtin-lexical-v1",
    "version": "0.1.0"
  },
  "authority_effect": "none",
  "benchmark_isolation": {
    "description": "repository-owned baseline fixture state keyed by unique Gauntlet run id",
    "strategy": "disposable_instance"
  },
  "capabilities": {
    "describe": {
      "support": "native"
    },
    "health": {
      "support": "native"
    },
    "recall": {
      "notes": "deterministic token-overlap probe baseline",
      "support": "native"
    },
    "remember": {
      "support": "native"
    },
    "reset": {
      "support": "native"
    }
  },
  "contract_family": "agent-memory-gauntlet-system-adapter",
  "contract_version": "0.1.0",
  "metadata": {
    "provenance_class": "baseline_or_probe",
    "trusted_fixture": true
  },
  "system": {
    "id": "gauntlet-lexical-baseline",
    "kind": "lexical",
    "revision": "builtin-lexical-v1",
    "version": "0.1.0"
  },
  "transport": {
    "callable": "agentmem_ref.evaluation.gauntlet_baselines:lexical_adapter",
    "kind": "in_process"
  }
}
